### ISSUE TITLE
connectivity issues

### ISSUE THREAD

**Issue by wilx** [haskell/hackage-server#302]
I am having intermittent connectivity issues with Hackage. Some Hackage connections succeed some do not. This shows as failing builds. This is a tail of my one attempted `cabal install -v3`:

```
In order, the following will be installed:
network-uri-2.6.0.1 (new package)
HTTP-4000.2.19 (reinstall) changes: network-2.4.1.2 -> 2.6.0.2,
network-uri-2.6.0.1 added
cabal-install-1.20.0.4 (new package)
Warning: Note that reinstalls are always dangerous. Continuing anyway...
Ready to install network-uri-2.6.0.1
Downloading network-uri-2.6.0.1...
Sending:
Waiting for install task to finish...
GET /packages/archive/network-uri/2.6.0.1/network-uri-2.6.0.1.tar.gz HTTP/1.1
Host: hackage.haskell.org
User-Agent: cabal-install/1.20.0.3 (linux; x86_64)

Creating new connection to hackage.haskell.org
Failed to install network-uri-2.6.0.1
Build log ( /home/wilx/.cabal/logs/network-uri-2.6.0.1.log ):
cabal: /home/wilx/.cabal/logs/network-uri-2.6.0.1.log: does not exist
```

I have captured this exchange with Wireshark and this is what I see:

```
No.     Time           Source                Destination           Protocol Length Info
    246 19.832279000   10.0.0.1              e.global-ssl.fastly.net TCP      74     53893→80 [SYN, ECN, CWR] Seq=0 Win=29200 Len=0 MSS=1460 SACK_PERM=1 TSval=641173940 TSecr=0 WS=128
I   247 19.871054000   e.global-ssl.fastly.net 10.0.0.1              TCP      74     80→53893 [SYN, ACK, ECN] Seq=0 Ack=1 Win=14280 Len=0 MSS=1440 SACK_PERM=1 TSval=1130529758 TSecr=641173940 WS=512
    248 19.871142000   10.0.0.1              e.global-ssl.fastly.net TCP      66     53893→80 [ACK] Seq=1 Ack=1 Win=29312 Len=0 TSval=641173979 TSecr=1130529758
    249 19.871405000   10.0.0.1              e.global-ssl.fastly.net TCP      98     [TCP segment of a reassembled PDU]
    251 19.910235000   e.global-ssl.fastly.net 10.0.0.1              TCP      60     80→53893 [RST] Seq=1 Win=0 Len=0
```

The connection gets established. Then the segment no. 249 is sent which contains the HTTP "GET" (but only part of the whole URL, if that matters) and then boom, RST from the Hackage host.

If I repeat the same Cabal install command a few times, it gets through and the file downloads.
